{
  "d:\\Nexus-main\\services\\foreign\\external\\two\\serverless.yml": {
    "versionFramework": "4.29.0",
    "servicePath": "d:\\Nexus-main\\services\\foreign\\external\\two\\serverless.yml",
    "serviceConfigFileName": "serverless.yml",
    "service": {
      "service": "f1-two-backend",
      "provider": {
        "name": "aws",
        "runtime": "python3.11",
        "region": "us-east-1",
        "stage": "dev",
        "environment": {
          "ANTHROPIC_API_KEY": "<REDACTED>",
          "STAGE": "${self:provider.stage}",
          "REGION": "${self:provider.region}"
        }
      },
      "functions": {
        "main": {
          "handler": "handlers.websocket.message.handler",
          "timeout": 300,
          "memorySize": 1024,
          "events": [
            {
              "http": {
                "path": "/f1/message",
                "method": "post",
                "cors": true
              }
            },
            {
              "websocket": {
                "route": "$connect"
              }
            },
            {
              "websocket": {
                "route": "$disconnect"
              }
            },
            {
              "websocket": {
                "route": "message"
              }
            }
          ]
        },
        "conversation": {
          "handler": "handlers.api.conversation.handler",
          "timeout": 30,
          "memorySize": 512,
          "events": [
            {
              "http": {
                "path": "/f1/conversation",
                "method": "post",
                "cors": true
              }
            },
            {
              "http": {
                "path": "/f1/conversation/{id}",
                "method": "get",
                "cors": true
              }
            }
          ]
        },
        "health": {
          "handler": "handlers.api.health.handler",
          "timeout": 10,
          "memorySize": 128,
          "events": [
            {
              "http": {
                "path": "/f1/health",
                "method": "get",
                "cors": true
              }
            }
          ]
        }
      },
      "plugins": [
        "serverless-python-requirements"
      ],
      "custom": {
        "pythonRequirements": {
          "dockerizePip": false,
          "slim": true,
          "strip": false
        }
      }
    },
    "provider": {
      "name": "aws",
      "runtime": "python3.11",
      "region": "us-east-1",
      "stage": "dev",
      "environment": {
        "ANTHROPIC_API_KEY": "<REDACTED>",
        "STAGE": "${self:provider.stage}",
        "REGION": "${self:provider.region}"
      }
    },
    "error": {
      "message": "You must sign in or use a license key with Serverless Framework V.4 and later versions. Please use \"serverless login\".",
      "stack": "Error: You must sign in or use a license key with Serverless Framework V.4 and later versions. Please use \"serverless login\".\n    at Authentication.getAuthenticatedData (file:///C:/Users/User/.serverless/releases/4.29.0/package/dist/sf-core.js:677:11187)\n    at process.processTicksAndRejections (node:internal/process/task_queues:105:5)\n    at async Authentication.authenticate (file:///C:/Users/User/.serverless/releases/4.29.0/package/dist/sf-core.js:680:4121)\n    at async TraditionalRunner.resolveVariablesAndAuthenticate (file:///C:/Users/User/.serverless/releases/4.29.0/package/dist/sf-core.js:688:2394)\n    at async TraditionalRunner.run (file:///C:/Users/User/.serverless/releases/4.29.0/package/dist/sf-core.js:1489:28091)\n    at async route (file:///C:/Users/User/.serverless/releases/4.29.0/package/dist/sf-core.js:1664:2848)\n    at async Object.run (file:///C:/Users/User/.serverless/releases/4.29.0/package/dist/sf-core.js:1665:3876)\n    at async run2 (file:///C:/Users/User/.serverless/releases/4.29.0/package/dist/sf-core.js:1665:5030)"
    },
    "serviceRawFile": "service: f1-two-backend\n\nprovider:\n  name: aws\n  runtime: python3.11\n  region: us-east-1\n  stage: ${opt:stage, 'dev'}\n  environment:\n    ANTHROPIC_API_KEY: ${env:ANTHROPIC_API_KEY}\n    STAGE: ${self:provider.stage}\n    REGION: ${self:provider.region}\n\nfunctions:\n  main:\n    handler: handlers.websocket.message.handler\n    timeout: 300\n    memorySize: 1024\n    events:\n      - http:\n          path: /f1/message\n          method: post\n          cors: true\n      - websocket:\n          route: $connect\n      - websocket:\n          route: $disconnect\n      - websocket:\n          route: message\n\n  conversation:\n    handler: handlers.api.conversation.handler\n    timeout: 30\n    memorySize: 512\n    events:\n      - http:\n          path: /f1/conversation\n          method: post\n          cors: true\n      - http:\n          path: /f1/conversation/{id}\n          method: get\n          cors: true\n\n  health:\n    handler: handlers.api.health.handler\n    timeout: 10\n    memorySize: 128\n    events:\n      - http:\n          path: /f1/health\n          method: get\n          cors: true\n\nplugins:\n  - serverless-python-requirements\n\ncustom:\n  pythonRequirements:\n    dockerizePip: false\n    slim: true\n    strip: false",
    "command": [
      "deploy"
    ],
    "options": {},
    "serviceProviderAwsCfStackId": null,
    "serviceProviderAwsCfStackCreated": null,
    "serviceProviderAwsCfStackUpdated": null,
    "serviceProviderAwsCfStackStatus": null,
    "serviceProviderAwsCfStackOutputs": null
  }
}